{
  "format": "boris-publication-profile",
  "schema_version": 1,
  "input": "content",
  "site": {
    "url": "https://owner.github.io/boris/",
    "title": "Boris",
    "description": "A deterministic documentation compiler."
  },
  "publication": {
    "target": "github-pages",
    "base_url": "https://owner.github.io/boris/",
    "origin": "https://owner.github.io/",
    "base_path": "/boris/"
  },
  "targets": [
    {
      "name": "public",
      "output": "dist",
      "public": true,
      "theme": "themes/boris",
      "sitemap": {
        "path": "sitemap.xml"
      }
    }
  ]
}
